{
  "schema_version": "3.0.0",
  "observation_id": "obs-v3-3db6deec69f88dc301cd7c2e06547d6349080a5182f291229ed4e73d3a976c13",
  "identity_inputs_sha256": "3db6deec69f88dc301cd7c2e06547d6349080a5182f291229ed4e73d3a976c13",
  "run_manifest_id": "run-v3-aaaaaaaaaaaaaaaaaaaaaaaaaaaaaaaaaaaaaaaaaaaaaaaaaaaaaaaaaaaaaaaa",
  "run_manifest_sha256": "bbbbbbbbbbbbbbbbbbbbbbbbbbbbbbbbbbbbbbbbbbbbbbbbbbbbbbbbbbbbbbbb",
  "acquisition_id": "acq-v3-dcb7dafaee610620b685a4cf0a06e541da32e25593a8c0b8a8e1a0c585b9259a",
  "acquisition_timestamp_utc": "2026-04-07T13:12:41Z",
  "observed_on": "2026-04-07",
  "monitoring_extent_id": "araripe-implementation-rectangle-v1",
  "algorithm_version": "2.0.0",
  "baseline_version": "2.0.0",
  "geometry_crs": "EPSG:4326",
  "geometry": {
    "type": "Polygon",
    "coordinates": [
      [
        [
          -40.0,
          -7.1
        ],
        [
          -39.9,
          -7.1
        ],
        [
          -39.9,
          -7.0
        ],
        [
          -40.0,
          -7.0
        ],
        [
          -40.0,
          -7.1
        ]
      ]
    ]
  },
  "canonical_geometry_sha256": "ce0b0669f9f217872ff550ace3440e4a4cbc9a609738574852fc045e910e6bee",
  "area_ha": 123.5,
  "raw_detection_policy": {
    "retained": true,
    "immutable": true,
    "context_can_remove": false,
    "persistence_can_remove": false
  },
  "created_at": "2026-04-07T13:30:00Z"
}
